{
  "$schema": "./schemas/trigger-evals.schema.json",
  "schema_version": "1.0",
  "suite_id": "report-skills-triggering-v1",
  "description_source": "../skills/{candidate_skill}/SKILL.md frontmatter description",
  "release_policy": "release-thresholds.json",
  "protocol": {
    "evaluation_mode": "binary_candidate_skill_selection_with_invocation_policy",
    "repetitions_per_case": 3,
    "fresh_context_per_run": true,
    "prediction_field": "triggered",
    "positive_definition": "triggered is true when should_trigger is true",
    "negative_definition": "triggered is false when should_trigger is false",
    "aggregate_metrics": ["precision", "recall"],
    "aggregate_scope": "all observations suite-wide and separately for every skill",
    "per_skill_metrics": "hard release gates; both precision and recall must meet threshold for every skill",
    "invocation_policies": {
      "implicit_selection": {
        "skills": [
          "creative-artifact-provenance",
          "editorial-data-storytelling",
          "evidence-first-report",
          "interactive-report-publisher",
          "motion-performance-qa",
          "report-content-repurposer",
          "report-visual-system",
          "visual-hygiene-auditor"
        ],
        "positive_rule": "A relevant natural-language query that does not name the skill should trigger it.",
        "negative_rule": "A near-miss natural-language query that does not name the skill should not trigger it."
      },
      "explicit_invocation": {
        "skills": [
          "pencil-safe-editor",
          "report-skills",
          "sites-release-manager"
        ],
        "positive_rule": "A relevant query containing the exact $skill-name should trigger it.",
        "negative_rule": "A query without the exact $skill-name should not trigger it, even when topically relevant."
      }
    },
    "minimum_distribution": {
      "skills": 11,
      "positive_cases_per_skill": 1,
      "negative_cases_per_implicit_skill": 1,
      "negative_cases_per_explicit_skill": 2
    }
  },
  "expected_case_count": 25,
  "cases": [
    {
      "case_id": "trigger-router-relevant-without-explicit",
      "candidate_skill": "report-skills",
      "invocation_policy": "explicit_invocation",
      "query_names_candidate_skill": false,
      "query": "Coordinate an evidence-backed report, chart specifications, an editable visual system, a complete responsive site, three QA passes, and a release-ready package; stop before any external publication.",
      "should_trigger": false,
      "expected_alternative": null,
      "near_miss_reason": "The router is explicit-only, so topical relevance without $report-skills must not auto-load it."
    },
    {
      "case_id": "trigger-router-explicit-positive",
      "candidate_skill": "report-skills",
      "invocation_policy": "explicit_invocation",
      "query_names_candidate_skill": true,
      "query": "Use $report-skills to coordinate an evidence-backed report, evidence visuals, an editable system, a responsive site, QA, and a release-ready package; stop before publication.",
      "should_trigger": true,
      "expected_alternative": null,
      "near_miss_reason": null
    },
    {
      "case_id": "trigger-router-negative",
      "candidate_skill": "report-skills",
      "invocation_policy": "explicit_invocation",
      "query_names_candidate_skill": false,
      "query": "Rewrite this two-sentence project update as a concise email; no research, report, visual, website, or publishing workflow is involved.",
      "should_trigger": false,
      "expected_alternative": null,
      "near_miss_reason": "This is ordinary copy editing rather than a research-to-publication workflow."
    },
    {
      "case_id": "trigger-evidence-positive",
      "candidate_skill": "evidence-first-report",
      "invocation_policy": "implicit_selection",
      "query_names_candidate_skill": false,
      "query": "Using this outline and evidence folder, establish a cutoff, build source and claim ledgers, separate facts from interpretation, draft the full report, and document academic, factual, and reader reviews.",
      "should_trigger": true,
      "expected_alternative": null,
      "near_miss_reason": null
    },
    {
      "case_id": "trigger-evidence-negative",
      "candidate_skill": "evidence-first-report",
      "invocation_policy": "implicit_selection",
      "query_names_candidate_skill": false,
      "query": "The report and claims are already approved; turn the verified statistics into annotated chart specifications with captions, alternative text, and provenance.",
      "should_trigger": false,
      "expected_alternative": "editorial-data-storytelling",
      "near_miss_reason": "The evidence and report are complete; the task begins at visual evidence design."
    },
    {
      "case_id": "trigger-story-positive",
      "candidate_skill": "editorial-data-storytelling",
      "invocation_policy": "implicit_selection",
      "query_names_candidate_skill": false,
      "query": "Convert these verified survey findings into meaningful charts and a timeline, preserving values, units, populations, dates, contextual annotations, accessible text, and linked provenance.",
      "should_trigger": true,
      "expected_alternative": null,
      "near_miss_reason": null
    },
    {
      "case_id": "trigger-story-negative",
      "candidate_skill": "editorial-data-storytelling",
      "invocation_policy": "implicit_selection",
      "query_names_candidate_skill": false,
      "query": "Create the analytical report itself from this research outline and evidence set, including a claim ledger, source cutoff, citations, limitations, and three review passes.",
      "should_trigger": false,
      "expected_alternative": "evidence-first-report",
      "near_miss_reason": "The task is report research and drafting, not visualizing already verified findings."
    },
    {
      "case_id": "trigger-visual-system-positive",
      "candidate_skill": "report-visual-system",
      "invocation_policy": "implicit_selection",
      "query_names_candidate_skill": false,
      "query": "Translate this approved long-form report into an editable neutral publication system with type and spacing tokens, reusable components, grids, layouts, hierarchy, and export constraints.",
      "should_trigger": true,
      "expected_alternative": null,
      "near_miss_reason": null
    },
    {
      "case_id": "trigger-visual-system-negative",
      "candidate_skill": "report-visual-system",
      "invocation_policy": "implicit_selection",
      "query_names_candidate_skill": false,
      "query": "Audit this already-built report website at desktop and narrow mobile widths for overflow, inconsistent spacing, chart legibility, cognitive load, and optical alignment.",
      "should_trigger": false,
      "expected_alternative": "visual-hygiene-auditor",
      "near_miss_reason": "The artifact already exists and needs multi-pass visual QA rather than a new publication system."
    },
    {
      "case_id": "trigger-interactive-positive",
      "candidate_skill": "interactive-report-publisher",
      "invocation_policy": "implicit_selection",
      "query_names_candidate_skill": false,
      "query": "Build the complete approved report as a responsive editorial website with chapter navigation, intact citations and limitations, mobile accessibility, metadata, restrained scroll interactions, and reduced-motion support.",
      "should_trigger": true,
      "expected_alternative": null,
      "near_miss_reason": null
    },
    {
      "case_id": "trigger-interactive-negative",
      "candidate_skill": "interactive-report-publisher",
      "invocation_policy": "implicit_selection",
      "query_names_candidate_skill": false,
      "query": "Define editable page templates, typography tokens, grids, and components for this report, but do not implement a website or interactive behavior.",
      "should_trigger": false,
      "expected_alternative": "report-visual-system",
      "near_miss_reason": "The requested deliverable is an editable visual system rather than a responsive website."
    },
    {
      "case_id": "trigger-visual-audit-positive",
      "candidate_skill": "visual-hygiene-auditor",
      "invocation_policy": "implicit_selection",
      "query_names_candidate_skill": false,
      "query": "Review this report publication in separate structural, typography and optical, and reader-comprehension passes across desktop and mobile, then return evidence-bound findings and a revision log.",
      "should_trigger": true,
      "expected_alternative": null,
      "near_miss_reason": null
    },
    {
      "case_id": "trigger-visual-audit-negative",
      "candidate_skill": "visual-hygiene-auditor",
      "invocation_policy": "implicit_selection",
      "query_names_candidate_skill": false,
      "query": "Diagnose the loader-to-first-reveal gap, ScrollTrigger startup order, reduced-motion behavior, and frame pacing with direct runtime measurements.",
      "should_trigger": false,
      "expected_alternative": "motion-performance-qa",
      "near_miss_reason": "This is specialized animation startup and performance validation, not broad visual hygiene."
    },
    {
      "case_id": "trigger-motion-positive",
      "candidate_skill": "motion-performance-qa",
      "invocation_policy": "implicit_selection",
      "query_names_candidate_skill": false,
      "query": "The loader disappears before the first scroll reveal and the page flashes blank; verify font and asset readiness, animation initialization, reduced motion, and measured frame pacing.",
      "should_trigger": true,
      "expected_alternative": null,
      "near_miss_reason": null
    },
    {
      "case_id": "trigger-motion-negative",
      "candidate_skill": "motion-performance-qa",
      "invocation_policy": "implicit_selection",
      "query_names_candidate_skill": false,